{
  "format": 1,
  "rev": 2,
  "name": "Campo 2,0",
  "guid": "00e72a4249cc60527510b943d590037e",
  "settings": {
    "fps": 30,
    "data": {
      "name": "Monte Cinzento",
      "area": "campo",
      "portals": [
        {
          "r": 5,
          "c": 14,
          "tc": 0,
          "to": "Campo 3,0",
          "tr": 5
        },
        {
          "r": 6,
          "c": 14,
          "tc": 0,
          "to": "Campo 3,0",
          "tr": 6
        },
        {
          "r": 7,
          "c": 14,
          "tc": 0,
          "to": "Campo 3,0",
          "tr": 7
        },
        {
          "r": 5,
          "c": 0,
          "tc": 14,
          "to": "Campo 1,0",
          "tr": 5
        },
        {
          "r": 6,
          "c": 0,
          "tc": 14,
          "to": "Campo 1,0",
          "tr": 6
        },
        {
          "r": 7,
          "c": 0,
          "tc": 14,
          "to": "Campo 1,0",
          "tr": 7
        },
        {
          "r": 12,
          "c": 6,
          "tc": 6,
          "to": "Campo 2,1",
          "tr": 0
        },
        {
          "r": 12,
          "c": 7,
          "tc": 7,
          "to": "Campo 2,1",
          "tr": 0
        },
        {
          "r": 12,
          "c": 8,
          "tc": 8,
          "to": "Campo 2,1",
          "tr": 0
        },
        {
          "r": 1,
          "c": 7,
          "tc": 7,
          "to": "Templo 1,2",
          "tr": 11
        }
      ],
      "room": "2,0",
      "screen": "game",
      "start": [
        7,
        5
      ]
    },
    "bg": "#0b1020",
    "static": false
  },
  "entities": [
    {
      "name": "Controle",
      "fid": "e_920c0f7a",
      "active": true,
      "z": 100,
      "transform": {
        "x": 0,
        "y": 0,
        "rot": 0,
        "sx": 1,
        "sy": 1,
        "ax": 0,
        "ay": 0
      },
      "components": [
        {
          "type": "script",
          "id": "c_cce7ff5d",
          "fields": {
            "script": "d32b7e44afaef263ffde5e79a5e69f3b"
          }
        }
      ]
    },
    {
      "name": "Heroi",
      "fid": "e_fb2f2b33",
      "active": true,
      "z": 10,
      "transform": {
        "x": 240,
        "y": 240,
        "rot": 0,
        "sx": 1,
        "sy": 1,
        "ax": 0.5,
        "ay": 0.5
      },
      "components": [
        {
          "type": "sprite",
          "id": "c_6e149848",
          "fields": {
            "key": "#000000",
            "sprite": "heroi#heroi0"
          }
        }
      ]
    },
    {
      "name": "Spawn 1",
      "fid": "e_88bcb258",
      "active": true,
      "z": 9,
      "transform": {
        "x": 112,
        "y": 208,
        "rot": 0,
        "sx": 1,
        "sy": 1,
        "ax": 0.5,
        "ay": 0.5
      },
      "components": [
        {
          "type": "sprite",
          "id": "c_4ebd5f65",
          "fields": {
            "key": "#000000",
            "sprite": "inimigos#inimigos0"
          }
        },
        {
          "type": "data",
          "id": "c_a23c8c8c",
          "fields": {
            "fields": {
              "type": "polvo",
              "kind": "enemy",
              "r": 4,
              "c": 3
            }
          }
        }
      ]
    },
    {
      "name": "Spawn 2",
      "fid": "e_06351167",
      "active": true,
      "z": 9,
      "transform": {
        "x": 368,
        "y": 208,
        "rot": 0,
        "sx": 1,
        "sy": 1,
        "ax": 0.5,
        "ay": 0.5
      },
      "components": [
        {
          "type": "sprite",
          "id": "c_198e99f8",
          "fields": {
            "key": "#000000",
            "sprite": "inimigos#inimigos0"
          }
        },
        {
          "type": "data",
          "id": "c_f04a8274",
          "fields": {
            "fields": {
              "type": "polvo",
              "kind": "enemy",
              "r": 4,
              "c": 11
            }
          }
        }
      ]
    },
    {
      "name": "Spawn 3",
      "fid": "e_2e64b5fe",
      "active": true,
      "z": 9,
      "transform": {
        "x": 240,
        "y": 400,
        "rot": 0,
        "sx": 1,
        "sy": 1,
        "ax": 0.5,
        "ay": 0.5
      },
      "components": [
        {
          "type": "sprite",
          "id": "c_72658971",
          "fields": {
            "key": "#000000",
            "sprite": "inimigos#inimigos0"
          }
        },
        {
          "type": "data",
          "id": "c_a9ed630c",
          "fields": {
            "fields": {
              "type": "polvo",
              "kind": "enemy",
              "r": 10,
              "c": 7
            }
          }
        }
      ]
    }
  ],
  "tilemaps": [
    {
      "cols": 15,
      "rows": 13,
      "id": "mapa",
      "layer": 0,
      "data": [
        8,
        8,
        8,
        8,
        8,
        8,
        8,
        8,
        8,
        8,
        8,
        8,
        8,
        8,
        8,
        8,
        8,
        8,
        8,
        8,
        8,
        8,
        21,
        8,
        8,
        8,
        8,
        8,
        8,
        8,
        8,
        8,
        0,
        0,
        0,
        0,
        8,
        0,
        8,
        0,
        0,
        0,
        0,
        8,
        8,
        8,
        0,
        0,
        0,
        0,
        0,
        0,
        0,
        0,
        0,
        0,
        0,
        0,
        0,
        8,
        8,
        0,
        0,
        0,
        0,
        0,
        0,
        0,
        0,
        0,
        0,
        0,
        0,
        0,
        8,
        0,
        0,
        0,
        0,
        0,
        0,
        0,
        0,
        0,
        0,
        0,
        0,
        0,
        0,
        0,
        0,
        0,
        0,
        0,
        0,
        0,
        0,
        8,
        0,
        0,
        0,
        0,
        0,
        0,
        0,
        0,
        0,
        0,
        0,
        0,
        0,
        0,
        0,
        0,
        0,
        0,
        0,
        0,
        0,
        0,
        8,
        0,
        0,
        0,
        0,
        8,
        0,
        0,
        0,
        8,
        0,
        0,
        0,
        0,
        8,
        8,
        0,
        0,
        0,
        0,
        0,
        0,
        0,
        0,
        0,
        0,
        0,
        0,
        0,
        8,
        8,
        0,
        0,
        8,
        8,
        0,
        0,
        0,
        0,
        0,
        8,
        8,
        0,
        0,
        8,
        8,
        0,
        0,
        0,
        0,
        0,
        0,
        0,
        0,
        0,
        0,
        0,
        0,
        0,
        8,
        8,
        8,
        8,
        8,
        8,
        8,
        0,
        0,
        0,
        8,
        8,
        8,
        8,
        8,
        8
      ],
      "solids": [
        true,
        true,
        true,
        true,
        true,
        true,
        true,
        true,
        true,
        true,
        true,
        true,
        true,
        true,
        true,
        true,
        true,
        true,
        true,
        true,
        true,
        true,
        false,
        true,
        true,
        true,
        true,
        true,
        true,
        true,
        true,
        true,
        false,
        false,
        false,
        false,
        true,
        false,
        true,
        false,
        false,
        false,
        false,
        true,
        true,
        true,
        false,
        false,
        false,
        false,
        false,
        false,
        false,
        false,
        false,
        false,
        false,
        false,
        false,
        true,
        true,
        false,
        false,
        false,
        false,
        false,
        false,
        false,
        false,
        false,
        false,
        false,
        false,
        false,
        true,
        false,
        false,
        false,
        false,
        false,
        false,
        false,
        false,
        false,
        false,
        false,
        false,
        false,
        false,
        false,
        false,
        false,
        false,
        false,
        false,
        false,
        false,
        true,
        false,
        false,
        false,
        false,
        false,
        false,
        false,
        false,
        false,
        false,
        false,
        false,
        false,
        false,
        false,
        false,
        false,
        false,
        false,
        false,
        false,
        false,
        true,
        false,
        false,
        false,
        false,
        true,
        false,
        false,
        false,
        true,
        false,
        false,
        false,
        false,
        true,
        true,
        false,
        false,
        false,
        false,
        false,
        false,
        false,
        false,
        false,
        false,
        false,
        false,
        false,
        true,
        true,
        false,
        false,
        true,
        true,
        false,
        false,
        false,
        false,
        false,
        true,
        true,
        false,
        false,
        true,
        true,
        false,
        false,
        false,
        false,
        false,
        false,
        false,
        false,
        false,
        false,
        false,
        false,
        false,
        true,
        true,
        true,
        true,
        true,
        true,
        true,
        false,
        false,
        false,
        true,
        true,
        true,
        true,
        true,
        true
      ],
      "cell": 32,
      "ox": 0,
      "oy": 64,
      "tileset": "307ea7d3e74365fa23309159636819ed"
    }
  ]
}
