{
  "format": 1,
  "rev": 6,
  "name": "Fase 1",
  "guid": "90e12a8e57ec99c81068080330772081",
  "settings": {
    "fps": 30,
    "data": {
      "name": "Jardim 1",
      "exit": [
        13,
        10
      ],
      "level": 1,
      "screen": "game",
      "theme": "garden",
      "time": 150
    },
    "bg": "#0a140e",
    "static": false,
    "assets": [
      "35caa2b39a8360f6b86144efe11a1ac6"
    ]
  },
  "entities": [
    {
      "name": "Jogador",
      "fid": "e_3e36a997",
      "active": true,
      "z": 20,
      "transform": {
        "x": 48,
        "y": 48,
        "rot": 0,
        "sx": 1,
        "sy": 1,
        "ax": 0.5,
        "ay": 0.5
      },
      "components": [
        {
          "type": "sprite",
          "id": "c_6e7594c4",
          "fields": {
            "key": "#ff00ff",
            "sprite": "35caa2b39a8360f6b86144efe11a1ac6#a0"
          }
        },
        {
          "type": "data",
          "id": "c_6f0d2818",
          "fields": {
            "fields": {
              "kind": "player"
            }
          }
        }
      ]
    },
    {
      "name": "Controle",
      "fid": "e_3b50f62c",
      "active": true,
      "z": 100,
      "transform": {
        "x": 0,
        "y": 0,
        "rot": 0,
        "sx": 1,
        "sy": 1,
        "ax": 0,
        "ay": 0
      },
      "components": [
        {
          "type": "script",
          "id": "c_13b03709",
          "fields": {
            "script": "52378124decf85728bb70f1163844877"
          }
        }
      ]
    },
    {
      "name": "Inimigo 1",
      "fid": "e_923df4ea",
      "active": true,
      "z": 19,
      "transform": {
        "x": 368,
        "y": 48,
        "rot": 0,
        "sx": 1,
        "sy": 1,
        "ax": 0.5,
        "ay": 0.5
      },
      "components": [
        {
          "type": "sprite",
          "id": "c_d1bee840",
          "fields": {
            "key": "#ff00ff",
            "sprite": "35caa2b39a8360f6b86144efe11a1ac6#a16"
          }
        },
        {
          "type": "data",
          "id": "c_f8bda811",
          "fields": {
            "fields": {
              "type": "slime",
              "kind": "enemy",
              "hp": 1
            }
          }
        }
      ]
    },
    {
      "name": "Inimigo 2",
      "fid": "e_05ca8ac2",
      "active": true,
      "z": 19,
      "transform": {
        "x": 48,
        "y": 368,
        "rot": 0,
        "sx": 1,
        "sy": 1,
        "ax": 0.5,
        "ay": 0.5
      },
      "components": [
        {
          "type": "sprite",
          "id": "c_566d580c",
          "fields": {
            "key": "#ff00ff",
            "sprite": "35caa2b39a8360f6b86144efe11a1ac6#a16"
          }
        },
        {
          "type": "data",
          "id": "c_b61b9574",
          "fields": {
            "fields": {
              "type": "slime",
              "kind": "enemy",
              "hp": 1
            }
          }
        }
      ]
    }
  ],
  "tilemaps": [
    {
      "cols": 15,
      "rows": 13,
      "id": "mapa",
      "layer": 0,
      "data": [
        1,
        1,
        1,
        1,
        1,
        1,
        1,
        1,
        1,
        1,
        1,
        1,
        1,
        1,
        1,
        1,
        0,
        0,
        0,
        0,
        0,
        0,
        0,
        0,
        0,
        0,
        0,
        0,
        0,
        1,
        1,
        0,
        1,
        2,
        1,
        0,
        1,
        2,
        1,
        2,
        1,
        0,
        1,
        0,
        1,
        1,
        2,
        2,
        2,
        0,
        0,
        0,
        0,
        2,
        0,
        2,
        0,
        2,
        0,
        1,
        1,
        2,
        1,
        0,
        1,
        2,
        1,
        0,
        1,
        0,
        1,
        0,
        1,
        0,
        1,
        1,
        0,
        0,
        2,
        2,
        2,
        2,
        0,
        0,
        2,
        2,
        0,
        0,
        0,
        1,
        1,
        2,
        1,
        0,
        1,
        0,
        0,
        0,
        0,
        0,
        1,
        2,
        1,
        0,
        1,
        1,
        2,
        2,
        0,
        0,
        0,
        0,
        0,
        0,
        0,
        2,
        0,
        2,
        0,
        1,
        1,
        2,
        1,
        0,
        1,
        2,
        1,
        0,
        1,
        2,
        1,
        2,
        1,
        0,
        1,
        1,
        0,
        0,
        0,
        0,
        0,
        2,
        2,
        0,
        2,
        2,
        0,
        2,
        0,
        1,
        1,
        2,
        1,
        0,
        1,
        0,
        1,
        2,
        1,
        0,
        1,
        0,
        1,
        2,
        1,
        1,
        0,
        0,
        2,
        0,
        2,
        2,
        0,
        2,
        0,
        2,
        0,
        2,
        0,
        1,
        1,
        0,
        1,
        1,
        1,
        1,
        1,
        1,
        1,
        1,
        1,
        1,
        1,
        1,
        1
      ],
      "solids": [
        true,
        true,
        true,
        true,
        true,
        true,
        true,
        true,
        true,
        true,
        true,
        true,
        true,
        true,
        true,
        true,
        false,
        false,
        false,
        false,
        false,
        false,
        false,
        false,
        false,
        false,
        false,
        false,
        false,
        true,
        true,
        false,
        true,
        true,
        true,
        false,
        true,
        true,
        true,
        true,
        true,
        false,
        true,
        false,
        true,
        true,
        true,
        true,
        true,
        false,
        false,
        false,
        false,
        true,
        false,
        true,
        false,
        true,
        false,
        true,
        true,
        true,
        true,
        false,
        true,
        true,
        true,
        false,
        true,
        false,
        true,
        false,
        true,
        false,
        true,
        true,
        false,
        false,
        true,
        true,
        true,
        true,
        false,
        false,
        true,
        true,
        false,
        false,
        false,
        true,
        true,
        true,
        true,
        false,
        true,
        false,
        false,
        false,
        false,
        false,
        true,
        true,
        true,
        false,
        true,
        true,
        true,
        true,
        false,
        false,
        false,
        false,
        false,
        false,
        false,
        true,
        false,
        true,
        false,
        true,
        true,
        true,
        true,
        false,
        true,
        true,
        true,
        false,
        true,
        true,
        true,
        true,
        true,
        false,
        true,
        true,
        false,
        false,
        false,
        false,
        false,
        true,
        true,
        false,
        true,
        true,
        false,
        true,
        false,
        true,
        true,
        true,
        true,
        false,
        true,
        false,
        true,
        true,
        true,
        false,
        true,
        false,
        true,
        true,
        true,
        true,
        false,
        false,
        true,
        false,
        true,
        true,
        false,
        true,
        false,
        true,
        false,
        true,
        false,
        true,
        true,
        false,
        true,
        true,
        true,
        true,
        true,
        true,
        true,
        true,
        true,
        true,
        true,
        true,
        true
      ],
      "cell": 32,
      "ox": 0,
      "oy": 0,
      "tileset": "8cdf654c152c85c8883e985a9ad6f907"
    }
  ]
}
