{
  "format": 1,
  "rev": 2,
  "name": "Templo 1,0",
  "guid": "614646561a7a72418d3079c6b9f98b25",
  "settings": {
    "fps": 30,
    "data": {
      "name": "Templo - Guardiao",
      "area": "masm",
      "portals": [
        {
          "r": 12,
          "c": 7,
          "tc": 7,
          "to": "Templo 1,1",
          "tr": 0
        }
      ],
      "room": "1,0",
      "screen": "game",
      "start": [
        7,
        6
      ]
    },
    "bg": "#0b1020",
    "static": false
  },
  "entities": [
    {
      "name": "Controle",
      "fid": "e_ab6f757c",
      "active": true,
      "z": 100,
      "transform": {
        "x": 0,
        "y": 0,
        "rot": 0,
        "sx": 1,
        "sy": 1,
        "ax": 0,
        "ay": 0
      },
      "components": [
        {
          "type": "script",
          "id": "c_70be5b7f",
          "fields": {
            "script": "d32b7e44afaef263ffde5e79a5e69f3b"
          }
        }
      ]
    },
    {
      "name": "Heroi",
      "fid": "e_fc51d983",
      "active": true,
      "z": 10,
      "transform": {
        "x": 240,
        "y": 272,
        "rot": 0,
        "sx": 1,
        "sy": 1,
        "ax": 0.5,
        "ay": 0.5
      },
      "components": [
        {
          "type": "sprite",
          "id": "c_c33c5fac",
          "fields": {
            "key": "#000000",
            "sprite": "heroi#heroi0"
          }
        }
      ]
    },
    {
      "name": "Spawn 1",
      "fid": "e_9ebf91de",
      "active": true,
      "z": 9,
      "transform": {
        "x": 240,
        "y": 176,
        "rot": 0,
        "sx": 0.75,
        "sy": 0.75,
        "ax": 0.5,
        "ay": 0.5
      },
      "components": [
        {
          "type": "sprite",
          "id": "c_0775128d",
          "fields": {
            "key": "#000000",
            "sprite": "chefe#chefe0"
          }
        },
        {
          "type": "data",
          "id": "c_8785e2f9",
          "fields": {
            "fields": {
              "type": "chefe",
              "kind": "enemy",
              "r": 3,
              "c": 7
            }
          }
        }
      ]
    }
  ],
  "tilemaps": [
    {
      "cols": 15,
      "rows": 13,
      "id": "mapa",
      "layer": 0,
      "data": [
        5,
        5,
        5,
        5,
        5,
        5,
        5,
        5,
        5,
        5,
        5,
        5,
        5,
        5,
        5,
        5,
        22,
        4,
        4,
        4,
        4,
        4,
        4,
        4,
        4,
        4,
        4,
        4,
        22,
        5,
        5,
        4,
        4,
        4,
        4,
        4,
        4,
        4,
        4,
        4,
        4,
        4,
        4,
        4,
        5,
        5,
        4,
        4,
        4,
        4,
        4,
        4,
        4,
        4,
        4,
        4,
        4,
        4,
        4,
        5,
        5,
        4,
        4,
        4,
        4,
        4,
        4,
        4,
        4,
        4,
        4,
        4,
        4,
        4,
        5,
        5,
        4,
        4,
        12,
        4,
        4,
        4,
        4,
        4,
        4,
        4,
        12,
        4,
        4,
        5,
        5,
        4,
        4,
        4,
        4,
        4,
        4,
        4,
        4,
        4,
        4,
        4,
        4,
        4,
        5,
        5,
        4,
        4,
        4,
        4,
        4,
        4,
        4,
        4,
        4,
        4,
        4,
        4,
        4,
        5,
        5,
        4,
        4,
        12,
        4,
        4,
        4,
        4,
        4,
        4,
        4,
        12,
        4,
        4,
        5,
        5,
        4,
        4,
        4,
        4,
        4,
        4,
        4,
        4,
        4,
        4,
        4,
        4,
        4,
        5,
        5,
        4,
        4,
        4,
        4,
        4,
        4,
        4,
        4,
        4,
        4,
        4,
        4,
        4,
        5,
        5,
        22,
        4,
        4,
        4,
        4,
        4,
        4,
        4,
        4,
        4,
        4,
        4,
        22,
        5,
        5,
        5,
        5,
        5,
        5,
        5,
        5,
        16,
        5,
        5,
        5,
        5,
        5,
        5,
        5
      ],
      "solids": [
        true,
        true,
        true,
        true,
        true,
        true,
        true,
        true,
        true,
        true,
        true,
        true,
        true,
        true,
        true,
        true,
        true,
        false,
        false,
        false,
        false,
        false,
        false,
        false,
        false,
        false,
        false,
        false,
        true,
        true,
        true,
        false,
        false,
        false,
        false,
        false,
        false,
        false,
        false,
        false,
        false,
        false,
        false,
        false,
        true,
        true,
        false,
        false,
        false,
        false,
        false,
        false,
        false,
        false,
        false,
        false,
        false,
        false,
        false,
        true,
        true,
        false,
        false,
        false,
        false,
        false,
        false,
        false,
        false,
        false,
        false,
        false,
        false,
        false,
        true,
        true,
        false,
        false,
        true,
        false,
        false,
        false,
        false,
        false,
        false,
        false,
        true,
        false,
        false,
        true,
        true,
        false,
        false,
        false,
        false,
        false,
        false,
        false,
        false,
        false,
        false,
        false,
        false,
        false,
        true,
        true,
        false,
        false,
        false,
        false,
        false,
        false,
        false,
        false,
        false,
        false,
        false,
        false,
        false,
        true,
        true,
        false,
        false,
        true,
        false,
        false,
        false,
        false,
        false,
        false,
        false,
        true,
        false,
        false,
        true,
        true,
        false,
        false,
        false,
        false,
        false,
        false,
        false,
        false,
        false,
        false,
        false,
        false,
        false,
        true,
        true,
        false,
        false,
        false,
        false,
        false,
        false,
        false,
        false,
        false,
        false,
        false,
        false,
        false,
        true,
        true,
        true,
        false,
        false,
        false,
        false,
        false,
        false,
        false,
        false,
        false,
        false,
        false,
        true,
        true,
        true,
        true,
        true,
        true,
        true,
        true,
        true,
        false,
        true,
        true,
        true,
        true,
        true,
        true,
        true
      ],
      "cell": 32,
      "ox": 0,
      "oy": 64,
      "tileset": "307ea7d3e74365fa23309159636819ed"
    }
  ]
}
