{
  "format": 1,
  "rev": 2,
  "name": "Vitoria",
  "guid": "d011cf3f699a9f267c2812bd9954cf1c",
  "settings": {
    "fps": 30,
    "data": {
      "screen": "win"
    },
    "bg": "#080c16",
    "static": true
  },
  "entities": [
    {
      "name": "Controle",
      "fid": "e_db68b8d8",
      "active": true,
      "z": 100,
      "transform": {
        "x": 0,
        "y": 0,
        "rot": 0,
        "sx": 1,
        "sy": 1,
        "ax": 0,
        "ay": 0
      },
      "components": [
        {
          "type": "script",
          "id": "c_55bd98ef",
          "fields": {
            "script": "52378124decf85728bb70f1163844877"
          }
        }
      ]
    }
  ],
  "tilemaps": []
}
