{
  "format": 1,
  "rev": 9,
  "name": "Templo 1,2",
  "guid": "dd9f96287d8daf84c18650ff32115a23",
  "settings": {
    "fps": 30,
    "data": {
      "name": "Templo - Entrada",
      "area": "masm",
      "portals": [
        {
          "r": 6,
          "c": 14,
          "tc": 0,
          "to": "Templo 2,2",
          "tr": 6
        },
        {
          "r": 6,
          "c": 0,
          "tc": 14,
          "to": "Templo 0,2",
          "tr": 6
        },
        {
          "r": 0,
          "c": 7,
          "tc": 7,
          "to": "Templo 1,1",
          "tr": 12
        },
        {
          "r": 12,
          "c": 7,
          "tc": 7,
          "to": "Campo 2,0",
          "tr": 2
        }
      ],
      "room": "1,2",
      "screen": "game",
      "start": [
        7,
        6
      ]
    },
    "bg": "#0b1020",
    "static": false,
    "assets": [
      "188539848446b129911ef98181d69bf7",
      "64a9c4c5cb3b42331c727887902eb02f",
      "69d15b259f7d6221161f2fb9b3e7a68f",
      "b90e46eda215549ba7b397acff34267b",
      "4919eb5e972456b506e1a4bfe997e47d"
    ]
  },
  "entities": [
    {
      "name": "Controle",
      "fid": "e_20c76605",
      "active": true,
      "z": 100,
      "transform": {
        "x": 0,
        "y": 0,
        "rot": 0,
        "sx": 1,
        "sy": 1,
        "ax": 0,
        "ay": 0
      },
      "components": [
        {
          "type": "script",
          "id": "c_e0061f48",
          "fields": {
            "script": "d32b7e44afaef263ffde5e79a5e69f3b"
          }
        }
      ]
    },
    {
      "name": "Heroi",
      "fid": "e_e072e016",
      "active": true,
      "z": 10,
      "transform": {
        "x": 240,
        "y": 272,
        "rot": 0,
        "sx": 1,
        "sy": 1,
        "ax": 0.5,
        "ay": 0.5
      },
      "components": [
        {
          "type": "sprite",
          "id": "c_605c36bf",
          "fields": {
            "key": "#ff00ff",
            "sprite": "9f6a2f6a81d96c8f9c1aff063e7914d9#h0"
          }
        }
      ]
    }
  ],
  "tilemaps": [
    {
      "cols": 15,
      "rows": 13,
      "id": "mapa",
      "layer": 0,
      "data": [
        5,
        5,
        5,
        5,
        5,
        5,
        5,
        16,
        5,
        5,
        5,
        5,
        5,
        5,
        5,
        5,
        22,
        4,
        4,
        4,
        4,
        4,
        4,
        4,
        4,
        4,
        4,
        4,
        22,
        5,
        5,
        4,
        4,
        4,
        4,
        4,
        4,
        4,
        4,
        4,
        4,
        4,
        4,
        4,
        5,
        5,
        4,
        4,
        12,
        4,
        4,
        4,
        4,
        4,
        4,
        4,
        12,
        4,
        4,
        5,
        5,
        4,
        4,
        4,
        4,
        4,
        4,
        4,
        4,
        4,
        4,
        4,
        4,
        4,
        5,
        5,
        4,
        4,
        4,
        4,
        4,
        4,
        4,
        4,
        4,
        4,
        4,
        4,
        4,
        5,
        16,
        4,
        4,
        4,
        4,
        4,
        4,
        4,
        4,
        4,
        4,
        4,
        4,
        4,
        16,
        5,
        4,
        4,
        4,
        4,
        4,
        4,
        4,
        4,
        4,
        4,
        4,
        4,
        4,
        5,
        5,
        4,
        4,
        4,
        4,
        4,
        4,
        4,
        4,
        4,
        4,
        4,
        4,
        4,
        5,
        5,
        4,
        4,
        12,
        4,
        4,
        4,
        4,
        4,
        4,
        4,
        12,
        4,
        4,
        5,
        5,
        4,
        4,
        4,
        4,
        4,
        4,
        4,
        4,
        4,
        4,
        4,
        4,
        4,
        5,
        5,
        22,
        4,
        4,
        4,
        4,
        4,
        4,
        4,
        4,
        4,
        4,
        4,
        22,
        5,
        5,
        5,
        5,
        5,
        5,
        5,
        5,
        20,
        5,
        5,
        5,
        5,
        5,
        5,
        5
      ],
      "solids": [
        true,
        true,
        true,
        true,
        true,
        true,
        true,
        false,
        true,
        true,
        true,
        true,
        true,
        true,
        true,
        true,
        true,
        false,
        false,
        false,
        false,
        false,
        false,
        false,
        false,
        false,
        false,
        false,
        true,
        true,
        true,
        false,
        false,
        false,
        false,
        false,
        false,
        false,
        false,
        false,
        false,
        false,
        false,
        false,
        true,
        true,
        false,
        false,
        true,
        false,
        false,
        false,
        false,
        false,
        false,
        false,
        true,
        false,
        false,
        true,
        true,
        false,
        false,
        false,
        false,
        false,
        false,
        false,
        false,
        false,
        false,
        false,
        false,
        false,
        true,
        true,
        false,
        false,
        false,
        false,
        false,
        false,
        false,
        false,
        false,
        false,
        false,
        false,
        false,
        true,
        false,
        false,
        false,
        false,
        false,
        false,
        false,
        false,
        false,
        false,
        false,
        false,
        false,
        false,
        false,
        true,
        false,
        false,
        false,
        false,
        false,
        false,
        false,
        false,
        false,
        false,
        false,
        false,
        false,
        true,
        true,
        false,
        false,
        false,
        false,
        false,
        false,
        false,
        false,
        false,
        false,
        false,
        false,
        false,
        true,
        true,
        false,
        false,
        true,
        false,
        false,
        false,
        false,
        false,
        false,
        false,
        true,
        false,
        false,
        true,
        true,
        false,
        false,
        false,
        false,
        false,
        false,
        false,
        false,
        false,
        false,
        false,
        false,
        false,
        true,
        true,
        true,
        false,
        false,
        false,
        false,
        false,
        false,
        false,
        false,
        false,
        false,
        false,
        true,
        true,
        true,
        true,
        true,
        true,
        true,
        true,
        true,
        false,
        true,
        true,
        true,
        true,
        true,
        true,
        true
      ],
      "cell": 32,
      "ox": 0,
      "oy": 64,
      "tileset": "307ea7d3e74365fa23309159636819ed"
    }
  ]
}
