{
  "format": 1,
  "rev": 6,
  "name": "Painel",
  "guid": "5712456b244547fd9871a77388fd859a",
  "settings": {
    "fps": 20,
    "data": {
      "auto": false,
      "bateria": 0,
      "bateriaTexto": "...",
      "brilho": 60,
      "ipTexto": "",
      "redeTexto": "...",
      "versao": "",
      "volume": 50
    },
    "bg": "#0b1020",
    "persist": "painel",
    "scripts": [
      "42270a750273dbfebaf6517310e301f7"
    ],
    "sub": "dispositivo"
  },
  "entities": [
    {
      "name": "CardBateria",
      "fid": "e_c91b13c2",
      "active": true,
      "z": 1,
      "transform": {
        "x": 8,
        "y": 48,
        "rot": 0,
        "sx": 1,
        "sy": 1
      },
      "components": [
        {
          "type": "ui.card",
          "id": "c_f2858246",
          "fields": {
            "w": 224,
            "h": 58,
            "radius": 10
          }
        }
      ]
    },
    {
      "name": "RotuloBateria",
      "fid": "e_bcd79737",
      "active": true,
      "z": 2,
      "transform": {
        "x": 18,
        "y": 56,
        "rot": 0,
        "sx": 1,
        "sy": 1
      },
      "components": [
        {
          "type": "ui.text",
          "id": "c_35fd97b5",
          "fields": {
            "text": "BATERIA",
            "color": "#8894a8",
            "role": "caption"
          }
        }
      ]
    },
    {
      "name": "ValorBateria",
      "fid": "e_aad9724b",
      "active": true,
      "z": 3,
      "transform": {
        "x": 18,
        "y": 72,
        "rot": 0,
        "sx": 1,
        "sy": 1
      },
      "components": [
        {
          "type": "ui.text",
          "id": "c_d4d79ba4",
          "fields": {
            "bind": "bateriaTexto",
            "role": "title"
          }
        }
      ]
    },
    {
      "name": "BarraBateria",
      "fid": "e_40cde3a8",
      "active": true,
      "z": 4,
      "transform": {
        "x": 18,
        "y": 94,
        "rot": 0,
        "sx": 1,
        "sy": 1
      },
      "components": [
        {
          "type": "ui.progress",
          "id": "c_f90e1875",
          "fields": {
            "w": 204,
            "h": 6,
            "key": "bateria"
          }
        }
      ]
    },
    {
      "name": "CardRede",
      "fid": "e_c1c98c18",
      "active": true,
      "z": 5,
      "transform": {
        "x": 8,
        "y": 112,
        "rot": 0,
        "sx": 1,
        "sy": 1
      },
      "components": [
        {
          "type": "ui.card",
          "id": "c_446c92df",
          "fields": {
            "w": 224,
            "h": 58,
            "radius": 10
          }
        }
      ]
    },
    {
      "name": "RotuloRede",
      "fid": "e_9173a386",
      "active": true,
      "z": 6,
      "transform": {
        "x": 18,
        "y": 120,
        "rot": 0,
        "sx": 1,
        "sy": 1
      },
      "components": [
        {
          "type": "ui.text",
          "id": "c_0e59b126",
          "fields": {
            "text": "REDE",
            "color": "#8894a8",
            "role": "caption"
          }
        }
      ]
    },
    {
      "name": "ValorRede",
      "fid": "e_387fc403",
      "active": true,
      "z": 7,
      "transform": {
        "x": 18,
        "y": 136,
        "rot": 0,
        "sx": 1,
        "sy": 1
      },
      "components": [
        {
          "type": "ui.text",
          "id": "c_c327acef",
          "fields": {
            "bind": "redeTexto"
          }
        }
      ]
    },
    {
      "name": "ValorIP",
      "fid": "e_2f62f95f",
      "active": true,
      "z": 8,
      "transform": {
        "x": 18,
        "y": 152,
        "rot": 0,
        "sx": 1,
        "sy": 1
      },
      "components": [
        {
          "type": "ui.text",
          "id": "c_a4b154a9",
          "fields": {
            "color": "#8894a8",
            "bind": "ipTexto",
            "role": "caption"
          }
        }
      ]
    },
    {
      "name": "CardTela",
      "fid": "e_ec457780",
      "active": true,
      "z": 9,
      "transform": {
        "x": 8,
        "y": 176,
        "rot": 0,
        "sx": 1,
        "sy": 1
      },
      "components": [
        {
          "type": "ui.card",
          "id": "c_db04d49e",
          "fields": {
            "w": 224,
            "h": 92,
            "radius": 10
          }
        }
      ]
    },
    {
      "name": "RotuloBrilho",
      "fid": "e_c4dcbd8e",
      "active": true,
      "z": 10,
      "transform": {
        "x": 18,
        "y": 184,
        "rot": 0,
        "sx": 1,
        "sy": 1
      },
      "components": [
        {
          "type": "ui.text",
          "id": "c_f9b401a8",
          "fields": {
            "text": "BRILHO",
            "color": "#8894a8",
            "role": "caption"
          }
        }
      ]
    },
    {
      "name": "SliderBrilho",
      "fid": "e_5ba3a24f",
      "active": true,
      "z": 11,
      "transform": {
        "x": 18,
        "y": 200,
        "rot": 0,
        "sx": 1,
        "sy": 1
      },
      "components": [
        {
          "type": "ui.slider",
          "id": "c_fb025bf1",
          "fields": {
            "w": 204,
            "key": "brilho",
            "event": "brilho"
          }
        }
      ]
    },
    {
      "name": "RotuloVolume",
      "fid": "e_09614ca9",
      "active": true,
      "z": 12,
      "transform": {
        "x": 18,
        "y": 232,
        "rot": 0,
        "sx": 1,
        "sy": 1
      },
      "components": [
        {
          "type": "ui.text",
          "id": "c_0ff735f4",
          "fields": {
            "text": "VOLUME",
            "color": "#8894a8",
            "role": "caption"
          }
        }
      ]
    },
    {
      "name": "SliderVolume",
      "fid": "e_4d9f80af",
      "active": true,
      "z": 13,
      "transform": {
        "x": 18,
        "y": 248,
        "rot": 0,
        "sx": 1,
        "sy": 1
      },
      "components": [
        {
          "type": "ui.slider",
          "id": "c_1418beb6",
          "fields": {
            "w": 150,
            "key": "volume",
            "event": "volume"
          }
        }
      ]
    },
    {
      "name": "ToggleAuto",
      "fid": "e_cb08675c",
      "active": true,
      "z": 14,
      "transform": {
        "x": 190,
        "y": 240,
        "rot": 0,
        "sx": 1,
        "sy": 1
      },
      "components": [
        {
          "type": "ui.toggle",
          "id": "c_8da07557",
          "fields": {
            "key": "auto",
            "id": "auto",
            "event": "auto"
          }
        }
      ]
    },
    {
      "name": "BotaoSobre",
      "fid": "e_8fd7ef27",
      "active": true,
      "z": 15,
      "transform": {
        "x": 8,
        "y": 276,
        "rot": 0,
        "sx": 1,
        "sy": 1
      },
      "components": [
        {
          "type": "ui.button",
          "id": "c_15a18cb5",
          "fields": {
            "w": 104,
            "h": 32,
            "id": "irSobre",
            "go": "Sobre",
            "label": "Sobre",
            "style": "primary"
          }
        }
      ]
    },
    {
      "name": "BotaoAtualizar",
      "fid": "e_1a083e1f",
      "active": true,
      "z": 16,
      "transform": {
        "x": 120,
        "y": 276,
        "rot": 0,
        "sx": 1,
        "sy": 1
      },
      "components": [
        {
          "type": "ui.button",
          "id": "c_138b3696",
          "fields": {
            "w": 112,
            "h": 32,
            "id": "atualizar",
            "event": "atualizar",
            "label": "Atualizar",
            "style": "ghost"
          }
        }
      ]
    }
  ],
  "tilemaps": []
}
