{
  "format": 1,
  "rev": 6,
  "name": "Conversa",
  "guid": "0a488af0d637d15f674b30dedbc45646",
  "settings": {
    "fps": 20,
    "data": {
      "audio": "",
      "estado": "pronto",
      "historico": [],
      "mensagens": [],
      "ocupado": false,
      "pergunta": "",
      "resposta": ""
    },
    "bg": "#0b1020",
    "scripts": [
      "be55398b2e99bf69f97781e239682d66"
    ],
    "sub": "texto e voz"
  },
  "entities": [
    {
      "name": "CardHistorico",
      "fid": "e_224af755",
      "active": true,
      "z": 1,
      "transform": {
        "x": 8,
        "y": 44,
        "rot": 0,
        "sx": 1,
        "sy": 1
      },
      "components": [
        {
          "type": "ui.card",
          "id": "c_09ffcea5",
          "fields": {
            "w": 224,
            "h": 156,
            "radius": 10
          }
        }
      ]
    },
    {
      "name": "Historico",
      "fid": "e_84583e9c",
      "active": true,
      "z": 2,
      "transform": {
        "x": 14,
        "y": 50,
        "rot": 0,
        "sx": 1,
        "sy": 1
      },
      "components": [
        {
          "type": "ui.list",
          "id": "c_77124640",
          "fields": {
            "w": 212,
            "h": 144,
            "id": "historico",
            "itemsBind": "mensagens",
            "rowH": 40
          }
        }
      ]
    },
    {
      "name": "CampoPergunta",
      "fid": "e_4c2b5207",
      "active": true,
      "z": 4,
      "transform": {
        "x": 12,
        "y": 204,
        "rot": 0,
        "sx": 1,
        "sy": 1
      },
      "components": [
        {
          "type": "ui.field",
          "id": "c_258fe62d",
          "fields": {
            "key": "pergunta",
            "hint": "toque para digitar",
            "label": "Texto"
          }
        }
      ]
    },
    {
      "name": "Estado",
      "fid": "e_c3ec0c3c",
      "active": true,
      "z": 7,
      "transform": {
        "x": 12,
        "y": 252,
        "rot": 0,
        "sx": 1,
        "sy": 1
      },
      "components": [
        {
          "type": "ui.text",
          "id": "c_12409848",
          "fields": {
            "color": "#8894a8",
            "bind": "estado",
            "role": "caption"
          }
        }
      ]
    },
    {
      "name": "BotaoEnviar",
      "fid": "e_bb0a880a",
      "active": true,
      "z": 5,
      "transform": {
        "x": 12,
        "y": 272,
        "rot": 0,
        "sx": 1,
        "sy": 1
      },
      "components": [
        {
          "type": "ui.button",
          "id": "c_7bf4ead8",
          "fields": {
            "w": 100,
            "h": 34,
            "id": "enviar",
            "event": "enviar",
            "label": "Enviar",
            "style": "primary"
          }
        }
      ]
    },
    {
      "name": "Microfone",
      "fid": "e_15c6559b",
      "active": true,
      "z": 6,
      "transform": {
        "x": 120,
        "y": 272,
        "rot": 0,
        "sx": 1,
        "sy": 1
      },
      "components": [
        {
          "type": "mic.record",
          "id": "c_4081116f",
          "fields": {
            "w": 112,
            "h": 34,
            "mode": "hold",
            "key": "audio",
            "label": "Segure p/ falar",
            "maxMs": 8000
          }
        }
      ]
    },
    {
      "name": "Motor",
      "fid": "e_f337574d",
      "active": true,
      "z": 8,
      "transform": {
        "x": 0,
        "y": 0,
        "rot": 0,
        "sx": 1,
        "sy": 1
      },
      "components": [
        {
          "type": "ai.chat",
          "id": "c_987ac61a",
          "fields": {
            "attach": "mic",
            "busyKey": "ocupado",
            "errorKey": "erro",
            "histKey": "historico",
            "history": true,
            "outKey": "resposta",
            "promptKey": "pergunta",
            "provider": "openrouter",
            "system": "Responda em portugues do Brasil, em no maximo 3 frases.",
            "trigger": "pedir"
          }
        },
        {
          "type": "ai.speak",
          "id": "c_5454e945",
          "fields": {
            "textKey": "resposta",
            "trigger": "falar",
            "voice": "Charon"
          }
        }
      ]
    }
  ],
  "tilemaps": []
}
