{
  "format": 1,
  "rev": 6,
  "name": "Fase 3",
  "guid": "5e79f66454d263dcc672fbb4156b1d23",
  "settings": {
    "fps": 30,
    "data": {
      "name": "Forno 1",
      "exit": [
        13,
        10
      ],
      "level": 3,
      "screen": "game",
      "theme": "forge",
      "time": 180
    },
    "bg": "#160a08",
    "static": false,
    "assets": [
      "35caa2b39a8360f6b86144efe11a1ac6"
    ]
  },
  "entities": [
    {
      "name": "Jogador",
      "fid": "e_b95dc7f6",
      "active": true,
      "z": 20,
      "transform": {
        "x": 48,
        "y": 48,
        "rot": 0,
        "sx": 1,
        "sy": 1,
        "ax": 0.5,
        "ay": 0.5
      },
      "components": [
        {
          "type": "sprite",
          "id": "c_b8140421",
          "fields": {
            "key": "#ff00ff",
            "sprite": "35caa2b39a8360f6b86144efe11a1ac6#a0"
          }
        },
        {
          "type": "data",
          "id": "c_aa7e6989",
          "fields": {
            "fields": {
              "kind": "player"
            }
          }
        }
      ]
    },
    {
      "name": "Controle",
      "fid": "e_a1ea45a7",
      "active": true,
      "z": 100,
      "transform": {
        "x": 0,
        "y": 0,
        "rot": 0,
        "sx": 1,
        "sy": 1,
        "ax": 0,
        "ay": 0
      },
      "components": [
        {
          "type": "script",
          "id": "c_585a006a",
          "fields": {
            "script": "52378124decf85728bb70f1163844877"
          }
        }
      ]
    },
    {
      "name": "Inimigo 1",
      "fid": "e_ef17b0dd",
      "active": true,
      "z": 19,
      "transform": {
        "x": 368,
        "y": 48,
        "rot": 0,
        "sx": 1,
        "sy": 1,
        "ax": 0.5,
        "ay": 0.5
      },
      "components": [
        {
          "type": "sprite",
          "id": "c_b92ab14c",
          "fields": {
            "key": "#ff00ff",
            "sprite": "35caa2b39a8360f6b86144efe11a1ac6#a24"
          }
        },
        {
          "type": "data",
          "id": "c_2c0be7ea",
          "fields": {
            "fields": {
              "type": "hunter",
              "kind": "enemy",
              "hp": 1
            }
          }
        }
      ]
    },
    {
      "name": "Inimigo 2",
      "fid": "e_4aedc384",
      "active": true,
      "z": 19,
      "transform": {
        "x": 48,
        "y": 368,
        "rot": 0,
        "sx": 1,
        "sy": 1,
        "ax": 0.5,
        "ay": 0.5
      },
      "components": [
        {
          "type": "sprite",
          "id": "c_3ba06613",
          "fields": {
            "key": "#ff00ff",
            "sprite": "35caa2b39a8360f6b86144efe11a1ac6#a16"
          }
        },
        {
          "type": "data",
          "id": "c_287d975e",
          "fields": {
            "fields": {
              "type": "slime",
              "kind": "enemy",
              "hp": 1
            }
          }
        }
      ]
    },
    {
      "name": "Inimigo 3",
      "fid": "e_133168be",
      "active": true,
      "z": 19,
      "transform": {
        "x": 368,
        "y": 368,
        "rot": 0,
        "sx": 1,
        "sy": 1,
        "ax": 0.5,
        "ay": 0.5
      },
      "components": [
        {
          "type": "sprite",
          "id": "c_dff8e977",
          "fields": {
            "key": "#ff00ff",
            "sprite": "35caa2b39a8360f6b86144efe11a1ac6#a16"
          }
        },
        {
          "type": "data",
          "id": "c_0ddf9ace",
          "fields": {
            "fields": {
              "type": "slime",
              "kind": "enemy",
              "hp": 1
            }
          }
        }
      ]
    }
  ],
  "tilemaps": [
    {
      "cols": 15,
      "rows": 13,
      "id": "mapa",
      "layer": 0,
      "data": [
        1,
        1,
        1,
        1,
        1,
        1,
        1,
        1,
        1,
        1,
        1,
        1,
        1,
        1,
        1,
        1,
        0,
        0,
        0,
        0,
        0,
        0,
        0,
        0,
        0,
        0,
        0,
        0,
        0,
        1,
        1,
        0,
        1,
        2,
        1,
        0,
        1,
        0,
        1,
        2,
        1,
        0,
        1,
        0,
        1,
        1,
        2,
        0,
        0,
        2,
        0,
        0,
        0,
        0,
        2,
        2,
        2,
        0,
        0,
        1,
        1,
        2,
        1,
        0,
        1,
        0,
        1,
        0,
        1,
        2,
        1,
        2,
        1,
        0,
        1,
        1,
        0,
        0,
        2,
        2,
        0,
        0,
        0,
        0,
        0,
        2,
        0,
        0,
        0,
        1,
        1,
        0,
        1,
        0,
        1,
        0,
        0,
        0,
        0,
        0,
        1,
        0,
        1,
        0,
        1,
        1,
        0,
        0,
        0,
        0,
        0,
        0,
        0,
        0,
        0,
        0,
        2,
        2,
        0,
        1,
        1,
        0,
        1,
        0,
        1,
        0,
        1,
        2,
        1,
        0,
        1,
        2,
        1,
        0,
        1,
        1,
        2,
        2,
        2,
        0,
        2,
        0,
        0,
        2,
        0,
        2,
        0,
        2,
        0,
        1,
        1,
        2,
        1,
        2,
        1,
        0,
        1,
        0,
        1,
        0,
        1,
        0,
        1,
        2,
        1,
        1,
        0,
        0,
        0,
        2,
        0,
        2,
        0,
        0,
        0,
        0,
        0,
        0,
        0,
        1,
        1,
        0,
        1,
        1,
        1,
        1,
        1,
        1,
        1,
        1,
        1,
        0,
        1,
        1,
        1
      ],
      "solids": [
        true,
        true,
        true,
        true,
        true,
        true,
        true,
        true,
        true,
        true,
        true,
        true,
        true,
        true,
        true,
        true,
        false,
        false,
        false,
        false,
        false,
        false,
        false,
        false,
        false,
        false,
        false,
        false,
        false,
        true,
        true,
        false,
        true,
        true,
        true,
        false,
        true,
        false,
        true,
        true,
        true,
        false,
        true,
        false,
        true,
        true,
        true,
        false,
        false,
        true,
        false,
        false,
        false,
        false,
        true,
        true,
        true,
        false,
        false,
        true,
        true,
        true,
        true,
        false,
        true,
        false,
        true,
        false,
        true,
        true,
        true,
        true,
        true,
        false,
        true,
        true,
        false,
        false,
        true,
        true,
        false,
        false,
        false,
        false,
        false,
        true,
        false,
        false,
        false,
        true,
        true,
        false,
        true,
        false,
        true,
        false,
        false,
        false,
        false,
        false,
        true,
        false,
        true,
        false,
        true,
        true,
        false,
        false,
        false,
        false,
        false,
        false,
        false,
        false,
        false,
        false,
        true,
        true,
        false,
        true,
        true,
        false,
        true,
        false,
        true,
        false,
        true,
        true,
        true,
        false,
        true,
        true,
        true,
        false,
        true,
        true,
        true,
        true,
        true,
        false,
        true,
        false,
        false,
        true,
        false,
        true,
        false,
        true,
        false,
        true,
        true,
        true,
        true,
        true,
        true,
        false,
        true,
        false,
        true,
        false,
        true,
        false,
        true,
        true,
        true,
        true,
        false,
        false,
        false,
        true,
        false,
        true,
        false,
        false,
        false,
        false,
        false,
        false,
        false,
        true,
        true,
        false,
        true,
        true,
        true,
        true,
        true,
        true,
        true,
        true,
        true,
        false,
        true,
        true,
        true
      ],
      "cell": 32,
      "ox": 0,
      "oy": 0,
      "tileset": "a5b2b2affeff84973d9317cd49e7c58a"
    }
  ]
}
