{
  "format": 1,
  "rev": 3,
  "name": "Legado",
  "guid": "96db9ffcea6c0a0b01b9c3f5173aa313",
  "settings": {
    "fps": 30,
    "bg": "#0b1020",
    "static": false
  },
  "entities": [
    {
      "name": "Titulo",
      "fid": "e_923100ef",
      "active": true,
      "z": 10,
      "transform": {
        "x": 240,
        "y": 220,
        "rot": 0,
        "sx": 1,
        "sy": 1,
        "ax": 0.5,
        "ay": 0.5
      },
      "components": [
        {
          "type": "text",
          "id": "c_af6c2380",
          "fields": {
            "text": "Arrasa! - runtime legado",
            "color": "#e8eefc",
            "px": 20,
            "align": "center"
          }
        }
      ]
    }
  ],
  "tilemaps": []
}
